<?xml version="1.0" encoding="UTF-8"?>
<forms xmlns="http://piwi.googlecode.com/xsd/forms" xmlns:xsi="http://www.w3.org/2001/XMLSchema-instance"
	xsi:schemaLocation="http://piwi.googlecode.com/xsd/forms ../../resources/xsd/forms.xsd">
	<language region="default">
		<form id="wizardform" href="custom/content/en/features/forms/wizardform.xml" />
		<form id="validatorform" href="custom/content/en/features/forms/validatorform.xml" />
		<form id="loginform" href="custom/content/en/forms/loginform.xml" />
		<form id="logoutform" href="custom/content/en/forms/logoutform.xml" />
	</language>
	<language region="de">
		<form id="wizardform" href="custom/content/de/features/forms/wizardform.xml" />
		<form id="validatorform" href="custom/content/de/features/forms/validatorform.xml" />
		<form id="loginform" href="custom/content/de/forms/loginform.xml" />
		<form id="logoutform" href="custom/content/de/forms/logoutform.xml" />
	</language>
</forms>